{
  "schema_version": 1,
  "id": "00000000-0000-4000-8000-000000000200",
  "mass_plan_id": "00000000-0000-4000-8000-000000000201",
  "items": [
    {
      "id": "00000000-0000-4000-8000-000000000202",
      "title": "Opening Hymn",
      "asset_ids": []
    }
  ],
  "assets": [],
  "assets_fingerprint": "e3b0c44298fc1c149afbf4c8996fb92427ae41e4649b934ca495991b7852b855"
}
