{
  "schema_version": 1,
  "id": "00000000-0000-4000-8000-000000000400",
  "mass_plan_id": "00000000-0000-4000-8000-000000000401",
  "items": [
    {
      "id": "00000000-0000-4000-8000-000000000500",
      "title": "Bahagi 1 — Pag-awit ng Papuri ñ",
      "asset_ids": []
    },
    {
      "id": "00000000-0000-4000-8000-000000000501",
      "title": "Bahagi 2 — Pag-awit ng Papuri ñ",
      "asset_ids": []
    },
    {
      "id": "00000000-0000-4000-8000-000000000502",
      "title": "Bahagi 3 — Pag-awit ng Papuri ñ",
      "asset_ids": []
    },
    {
      "id": "00000000-0000-4000-8000-000000000503",
      "title": "Bahagi 4 — Pag-awit ng Papuri ñ",
      "asset_ids": []
    },
    {
      "id": "00000000-0000-4000-8000-000000000504",
      "title": "Bahagi 5 — Pag-awit ng Papuri ñ",
      "asset_ids": []
    },
    {
      "id": "00000000-0000-4000-8000-000000000505",
      "title": "Bahagi 6 — Pag-awit ng Papuri ñ",
      "asset_ids": []
    },
    {
      "id": "00000000-0000-4000-8000-000000000506",
      "title": "Bahagi 7 — Pag-awit ng Papuri ñ",
      "asset_ids": []
    },
    {
      "id": "00000000-0000-4000-8000-000000000507",
      "title": "Bahagi 8 — Pag-awit ng Papuri ñ",
      "asset_ids": []
    },
    {
      "id": "00000000-0000-4000-8000-000000000508",
      "title": "Bahagi 9 — Pag-awit ng Papuri ñ",
      "asset_ids": []
    },
    {
      "id": "00000000-0000-4000-8000-000000000509",
      "title": "Bahagi 10 — Pag-awit ng Papuri ñ",
      "asset_ids": []
    },
    {
      "id": "00000000-0000-4000-8000-000000000510",
      "title": "Bahagi 11 — Pag-awit ng Papuri ñ",
      "asset_ids": []
    },
    {
      "id": "00000000-0000-4000-8000-000000000511",
      "title": "Bahagi 12 — Pag-awit ng Papuri ñ",
      "asset_ids": []
    },
    {
      "id": "00000000-0000-4000-8000-000000000512",
      "title": "Bahagi 13 — Pag-awit ng Papuri ñ",
      "asset_ids": []
    },
    {
      "id": "00000000-0000-4000-8000-000000000513",
      "title": "Bahagi 14 — Pag-awit ng Papuri ñ",
      "asset_ids": []
    },
    {
      "id": "00000000-0000-4000-8000-000000000514",
      "title": "Bahagi 15 — Pag-awit ng Papuri ñ",
      "asset_ids": []
    },
    {
      "id": "00000000-0000-4000-8000-000000000515",
      "title": "Bahagi 16 — Pag-awit ng Papuri ñ",
      "asset_ids": []
    },
    {
      "id": "00000000-0000-4000-8000-000000000516",
      "title": "Bahagi 17 — Pag-awit ng Papuri ñ",
      "asset_ids": []
    },
    {
      "id": "00000000-0000-4000-8000-000000000517",
      "title": "Bahagi 18 — Pag-awit ng Papuri ñ",
      "asset_ids": []
    },
    {
      "id": "00000000-0000-4000-8000-000000000518",
      "title": "Bahagi 19 — Pag-awit ng Papuri ñ",
      "asset_ids": []
    },
    {
      "id": "00000000-0000-4000-8000-000000000519",
      "title": "Bahagi 20 — Pag-awit ng Papuri ñ",
      "asset_ids": []
    },
    {
      "id": "00000000-0000-4000-8000-000000000520",
      "title": "Bahagi 21 — Pag-awit ng Papuri ñ",
      "asset_ids": []
    },
    {
      "id": "00000000-0000-4000-8000-000000000521",
      "title": "Bahagi 22 — Pag-awit ng Papuri ñ",
      "asset_ids": []
    },
    {
      "id": "00000000-0000-4000-8000-000000000522",
      "title": "Bahagi 23 — Pag-awit ng Papuri ñ",
      "asset_ids": []
    },
    {
      "id": "00000000-0000-4000-8000-000000000523",
      "title": "Bahagi 24 — Pag-awit ng Papuri ñ",
      "asset_ids": []
    },
    {
      "id": "00000000-0000-4000-8000-000000000524",
      "title": "Bahagi 25 — Pag-awit ng Papuri ñ",
      "asset_ids": []
    },
    {
      "id": "00000000-0000-4000-8000-000000000525",
      "title": "Bahagi 26 — Pag-awit ng Papuri ñ",
      "asset_ids": []
    },
    {
      "id": "00000000-0000-4000-8000-000000000526",
      "title": "Bahagi 27 — Pag-awit ng Papuri ñ",
      "asset_ids": []
    },
    {
      "id": "00000000-0000-4000-8000-000000000527",
      "title": "Bahagi 28 — Pag-awit ng Papuri ñ",
      "asset_ids": []
    },
    {
      "id": "00000000-0000-4000-8000-000000000528",
      "title": "Bahagi 29 — Pag-awit ng Papuri ñ",
      "asset_ids": []
    },
    {
      "id": "00000000-0000-4000-8000-000000000529",
      "title": "Bahagi 30 — Pag-awit ng Papuri ñ",
      "asset_ids": []
    }
  ],
  "assets": [],
  "assets_fingerprint": "e3b0c44298fc1c149afbf4c8996fb92427ae41e4649b934ca495991b7852b855"
}
